regNum;classCode;professor;fullTitle;dept;dNum;titleString;day;time1;time2;location;building;room;credit;enrollment;available;fyReservedSeats;max;distributions;distCode;distDescription;prerequisites;description;waitlistType;firstComeFirstServe;waitlistNotes
13970;ANTH 314 01;;ANTH 314 Human Biology and Society;ANTH;314;Human Biology and Society;MTh;01:30 pm;02:40 pm;Pendleton Hall East-216;Pendleton Hall East;216;1;5;10;N/A;15;;SBA;Social and Behavioral Analysis;ANTH 204, ANTH 214, or permission of the instructor.;This seminar will provide an anthropological perspective on the intersection between human biology and society in three related topics. The first unit will focus on human genetic diversity and the increasing use of genetic information in society. Included in this unit will be discussions of genetic ancestry testing and the construction of identity. The second unit will examine in more detail the genetic basis of phenotypic traits and disease, exploring what our genes can reveal about us while also considering the problems of biological determinism. The final unit will extend the understanding of human biological variation by looking at the relationship between humans and our environment, how our environment changed throughout prehistory and contemporary times, and what role the environment plays in shaping human variation.;;;
11049;ARAB 101 01;;ARAB 101 Elementary Arabic;ARAB;101;Elementary Arabic;MTWTh;08:30 am;09:40 am;Green Hall-338;Green Hall;338;1;15;0;N/A;15;;;None;None;An introduction to the Arabic language. The course takes a comprehensive approach to language learning and emphasizes the four skills of listening, speaking, reading, and writing. Students are introduced to the principles of grammar, taught how to read and write in the Arabic alphabet, and trained in the basics of everyday conversation. Through the use of a variety of written, video, and audio materials, as well as other resources made available through the Web, the course emphasizes authentic materials and stresses the active participation of students in the learning process.;;;
11362;ARAB 101 02;;ARAB 101 Elementary Arabic;ARAB;101;Elementary Arabic;MTWTh;09:50 am;11:00 am;Green Hall-338;Green Hall;338;1;15;0;N/A;15;;;None;None;An introduction to the Arabic language. The course takes a comprehensive approach to language learning and emphasizes the four skills of listening, speaking, reading, and writing. Students are introduced to the principles of grammar, taught how to read and write in the Arabic alphabet, and trained in the basics of everyday conversation. Through the use of a variety of written, video, and audio materials, as well as other resources made available through the Web, the course emphasizes authentic materials and stresses the active participation of students in the learning process.;;;
11050;ARAB 201 01;;ARAB 201 Intermediate Arabic;ARAB;201;Intermediate Arabic;MWTh;08:30 am;09:40 am;Green Hall-428;Green Hall;428;1;9;6;N/A;15;;;None;ARAB 101, ARAB 102, or permission of the instructor.;A continuation of ARAB 101-ARAB 102. The course takes students to a deeper and more complex level in the study of the Arabic language. While continuing to emphasize the organizing principles of the language, the course also introduces students to a variety of challenging texts, including extracts from newspaper articles, as well as literary and religious materials. Students will be trained to work with longer texts and to gain the necessary communicative skills to prepare them for advanced-level Arabic.;;;
11888;ARAB 201 02;;ARAB 201 Intermediate Arabic;ARAB;201;Intermediate Arabic;MWTh;09:50 am;11:00 am;Green Hall-136C;Green Hall;136C;1;15;0;N/A;15;;;None;ARAB 101, ARAB 102, or permission of the instructor.;A continuation of ARAB 101-ARAB 102. The course takes students to a deeper and more complex level in the study of the Arabic language. While continuing to emphasize the organizing principles of the language, the course also introduces students to a variety of challenging texts, including extracts from newspaper articles, as well as literary and religious materials. Students will be trained to work with longer texts and to gain the necessary communicative skills to prepare them for advanced-level Arabic.;;;
13971;ARAB 301 01;;ARAB 301 Advanced Arabic I;ARAB;301;Advanced Arabic I;W;01:30 pm;04:00 pm;Founders Hall-305;Founders Hall;305;1;8;7;N/A;15;;LL;Language and Literature;ARAB 201-ARAB 202 or permission of the instructor.;Continuation of ARAB 201-ARAB 202. Involving further development of students' skills in listening, speaking, reading, and writing, this course exposes students to a variety of authentic Arabic materials, including print and online sources, incorporating MSA and diglossia. Focus on enhanced communication skills in Arabic and attention to the use of language in its sociocultural context. Appropriate for students who have completed ARAB 201-ARAB 202 at Wellesley or the equivalent in summer courses or international study programs.;;;
13246;ARTH 100 01;;ARTH 100 The Power of Images:  An Introduction to Art and its Histories;ARTH;100;The Power of Images: An Introduction to Art and its Histories;MTh;11:10 am;12:20 pm;Jewett Art Center-454;Jewett Art Center;454;1;17;1;7;18;;ARS;Arts, Music, Theatre, Film and Video;None;Why does art matter? Because images, buildings, and environments shape our ways of understanding our world and ourselves. Learning how to look closely and analyze what you see, therefore, is fundamental to a liberal arts education. Within a global frame, this course provides an introduction to art and its histories through a series of case studies, from ancient China's terra cotta army to Picasso's Demoiselles d'Avignon.</em> Meeting twice weekly, each section will draw on the case studies to explore concepts of gender and race, cultural appropriation, political propaganda, and other issues through short lectures and class discussions. Site visits and assignments will engage with the rich art and architectural resources of Wellesley campus.;;;
10171;ARTH 100 02;;ARTH 100 The Power of Images:  An Introduction to Art and its Histories;ARTH;100;The Power of Images: An Introduction to Art and its Histories;MTh;01:30 pm;02:40 pm;Jewett Art Center-454;Jewett Art Center;454;1;16;2;7;18;;ARS;Arts, Music, Theatre, Film and Video;None;Why does art matter? Because images, buildings, and environments shape our ways of understanding our world and ourselves. Learning how to look closely and analyze what you see, therefore, is fundamental to a liberal arts education. Within a global frame, this course provides an introduction to art and its histories through a series of case studies, from ancient China's terra cotta army to Picasso's Demoiselles d'Avignon.</em> Meeting twice weekly, each section will draw on the case studies to explore concepts of gender and race, cultural appropriation, political propaganda, and other issues through short lectures and class discussions. Site visits and assignments will engage with the rich art and architectural resources of Wellesley campus.;;;
13840;ARTH 100 03;;ARTH 100 The Power of Images:  An Introduction to Art and its Histories;ARTH;100;The Power of Images: An Introduction to Art and its Histories;TF;09:50 am;11:00 am;Jewett Art Center-450;Jewett Art Center;450;1;16;2;7;18;;ARS;Arts, Music, Theatre, Film and Video;None;Why does art matter? Because images, buildings, and environments shape our ways of understanding our world and ourselves. Learning how to look closely and analyze what you see, therefore, is fundamental to a liberal arts education. Within a global frame, this course provides an introduction to art and its histories through a series of case studies, from ancient China's terra cotta army to Picasso's Demoiselles d'Avignon.</em> Meeting twice weekly, each section will draw on the case studies to explore concepts of gender and race, cultural appropriation, political propaganda, and other issues through short lectures and class discussions. Site visits and assignments will engage with the rich art and architectural resources of Wellesley campus.;;;
13598;ARTH 200 01;;ARTH 200 Architecture and Urban Form;ARTH;200;Architecture and Urban Form;W;02:15 pm;04:45 pm;Jewett Art Center-450;Jewett Art Center;450;1;25;0;N/A;25;;ARS;Arts, Music, Theatre, Film and Video;None;An introduction to the study of architecture and the built environment. This course is limited to majors or prospective majors in architecture, art history, studio art, or urban studies, or to those students with a serious interest in theoretical and methodological approaches to those fields.;;;
13972;ARTH 218 01;;ARTH 218 From Van Eyck to Bruegel: Painting in the Netherlands in the Fifteenth and Sixteenth Centuries;ARTH;218;From Van Eyck to Bruegel: Painting in the Netherlands in the Fifteenth and Sixteenth Centuries;TF;11:10 am;12:20 pm;Jewett Art Center-452;Jewett Art Center;452;1;8;12;N/A;20;;ARS;Arts, Music, Theatre, Film and Video;None. ARTH 101 recommended.;Focusing on the works of Jan van Eyck, Hieronymus Bosch, and Peter Bruegel the Elder, this course surveys the development of devotional panel painting and the emergence of the independent genres of portraiture, landscape, and scenes from daily life. Of special interest will be the changing role of art in an era of momentous political and religious change, and the ways in which that change is registered in the works of these particularly "engaged" artists.;;;
13973;ARTH 241 01;;ARTH 241 Egyptian Art and Archaeology;ARTH;241;Egyptian Art and Archaeology;W;02:15 pm;04:45 pm;Pendleton Hall East-239;Pendleton Hall East;239;1;28;2;5;30;;ARS;Arts, Music, Theatre, Film and Video;None. ARTH 100 recommended.;The greater Nile Valley has yielded some of the world's most ancient and compelling monuments. In this course we will survey the art and architecture of ancient Egypt from Neolithic times (c. 6000 B.C.) through the Roman period (c. second century A.D.). One class session per month will meet in the Museum of Fine Arts.;;;
13974;ARTH 248 01;;ARTH 248 Chinese Painting: Theories, Masters, and Principles;ARTH;248;Chinese Painting: Theories, Masters, and Principles;MTh;08:30 am;09:40 am;Jewett Art Center-450;Jewett Art Center;450;1;18;2;N/A;20;;ARS;Arts, Music, Theatre, Film and Video;None. ARTH 100 and ARTH 101 recommended.;Chinese painting can rival the European painting tradition in the quantity and diversity of its output, the number of recorded artists of note, the complexity of aesthetic issues attached to it, and the sophistication of the written literature that accompanies it through the centuries. This course examines Chinese painting from early times to the turn of the twentieth century with an introduction to traditional connoisseurship. Issues to be considered include major themes, styles, formats, and functions of Chinese painting. Special attention is given to imperial patronage| the relationship between painting, calligraphy, and poetry| literati ideal versus professionalism| gender and display| and the tension between tradition and creativity. Trips to the Museum of Fine Arts, Boston, and the Metropolitan Museum of Art, New York City.;;;
;;;;;;;;;;;;xs;xs;12"><div class="col;xs;N/A;12"></div><div class="col;;;;None.;;;;
13976;ARTH 289 01;;ARTH 289 Nineteenth-Century European Art;ARTH;289;Nineteenth-Century European Art;TF;08:30 am;09:40 am;Jewett Art Center-450;Jewett Art Center;450;1;16;4;N/A;20;;ARS;Arts, Music, Theatre, Film and Video;None. ARTH 100 and ARTH 101 recommended.;This course<strong> </strong>surveys European art from the French Revolution of 1789 to the Paris Universal Exhibition of 1900. Focusing on such major movements as Neoclassicism, Romanticism, Realism, Impressionism, and Art Nouveau, we will examine the relationship of art to tradition, revolution, empire, social change, technology, and identity. Emphasis is placed on the representation and experience of modern life, in paintings by David, Goya, Turner, Manet, Seurat, and others, and in venues ranging from political festivals to avant-garde art galleries to London&rsquo|s Crystal Palace. Topics include the expanded audience for art, Orientalism, gender and representation, and the aesthetics of leisure.;;;
14072;ARTH 313 01;;ARTH 313 Seminar: Eurasia: Empires, Merchants, and Missionaries (1600 - 1800);ARTH;313;Seminar: Eurasia: Empires, Merchants, and Missionaries (1600 - 1800);Th;09:50 am;12:20 pm;Jewett Art Center-452;Jewett Art Center;452;1;5;8;N/A;13;;ARS;Arts, Music, Theatre, Film and Video;Recommended ARTH 100 and ARTH 101 or by permission of instructor.;This course examines forms of artistic and material exchange across the diverse cultures of Europe and Asia in the early modern era (c.1600-1800). Its aim is to realign Western Europe's art and history of the early modern period in relation to its continental neighbors. Case studies will be drawn from the Ottoman and Mughal Empires, the Dutch Republic, the British East India Company, and many more. We will examine how trade networks united various artistic traditions, and how artisans, merchants, missionaries and other intermediaries reinterpreted and disseminated practices of representation across geographic and cultural boundaries.;;;
14071;ARTH 317 01;;ARTH 317 Historic Preservation: Theory and Practice;ARTH;317;Historic Preservation: Theory and Practice;W;09:50 am;12:20 pm;Jewett Art Center-452;Jewett Art Center;452;1;9;4;N/A;13;;ARS;Arts, Music, Theatre, Film and Video;ARTH 200 or permission of instructor;Using the campus of Wellesley College as a case study, this course will explore the theory and practice of historic preservation. Beginning with a focus on the history of preservation in the United States, we will trace the development of legal, economic, public policy, and cultural frameworks that have shaped attitudes and approaches toward the preservation of our built environment. To ground these theoretical discussions, we will use the Wellesley College campus as a laboratory for understanding the benefits and challenges of historic preservation.  Students will engage in both individual and group projects that will emphasize field study of buildings and landscapes, archival research, planning, and advocacy. The course is designed for Architecture and Art History majors, but could also be of interest to students in History, American Studies, Environmental Studies and Political Science.;;;
13977;ARTH 331 01;;ARTH 331 Seminar: The Art of Northern Europe;ARTH;331;Seminar: The Art of Northern Europe;Th;02:50 pm;05:20 pm;Jewett Art Center-452;Jewett Art Center;452;1;12;3;N/A;15;;ARS;Arts, Music, Theatre, Film and Video;None. ARTH 100 or 101 recommended.;<strong>Topic for 2016-17:&nbsp|Virtue, Vice, and Violence: Erotic themes in early modern prints and paintings </strong>|Love, marriage, same-sex desire, prostitution, rape, murder--these were themes addressed by some of the most ambitious artists of the 15th through 17th centuries. The class will examine how, in registering a dawning sense of erotic possibility--and anxiety--these artists challenged and transformed the realist tradition in western European art. Special attention will be paid to works by D&uuml|rer, Cranach, Caravaggio, Rubens and Rembrandt.;;;
13978;ARTH 335 01;;ARTH 335 Topics in Modern Art;ARTH;335;Topics in Modern Art;T;01:30 pm;04:00 pm;Jewett Art Center-218;Jewett Art Center;218;1;11;34;N/A;45;;ARS;Arts, Music, Theatre, Film and Video;Open to all Juniors and Seniors, and to Sophomores by permission of the instructors.;<strong>Topic for 2016-17: Postwar Modern: Art, Architecture and Music in America, 1945-65</strong>|<strong></strong>[|]This interdisciplinary course examines the development of American modernism in art, design, music, and architecture from WWII to 1965, with special emphasis on the sites and institutional contexts of this development (e.g., Museum of Modern Art, Black Mountain College, Wellesley College, Harvard University, and MIT, among others). In addition to our study of Paul Rudolph, John Cage, and the de Koonings, among others, we will use two Davis Museum exhibitions, "Partners in Design: Alfred H. Barr, Jr. and Philip Johnson," and "Anni Albers" as our laboratories.<strong></strong>|;;;
14206;ARTH 343 01;;ARTH 343 Seminar: Roman Monuments: Memory and Metamorphosis;ARTH;343;Seminar: Roman Monuments: Memory and Metamorphosis;Th;06:00 pm;08:30 pm;Jewett Art Center-452;Jewett Art Center;452;1;11;2;N/A;13;;ARS;Arts, Music, Theatre, Film and Video;Prior coursework in Art History or Classical Civilization or permission of instructor;Monuments like the Colosseum, Trajan&rsquo|s Column, and the Arch of Constantine have stood for nearly 2,000 years, but every generation has reframed their meaning. Each of our sessions will therefore evaluate the long life of a different monument from ancient Rome.  We will consider both the commemorative strategies that generated the art and architecture and the changing historical values that have prompted preservation or plunder of carved stone.  The seminar will also help research the Davis Museum&rsquo|s upcoming exhibit presenting Piranesi&rsquo|s etchings of the monuments as they appeared in the 18th century.;;;
13979;ARTH 364 01;;ARTH 364 Women Filmmakers: History and Theory of Subversion;ARTH;364;Women Filmmakers: History and Theory of Subversion;W;09:50 am;12:20 pm;Jewett Art Center-454;Jewett Art Center;454;1;11;4;N/A;15;;ARS;Arts, Music, Theatre, Film and Video;One of the following courses: ARTH 224, ARTH 225, ARTH 226/CAMS 207| or WGST 120 or WGST 222| or by permission of the instructor.;A survey of the history of women making films and an exploration of the issues of representation using films directed by women from around the world. We will review the history and emergence of women/feminist filmmakers and examine the impact of feminism and feminist film theory on women filmmakers in particular, and the film industry in general. Required activities include weekly screenings of films, written analytical reports, and classroom presentations.;;;
13982;ARTS 105 01;;ARTS 105 Drawing I;ARTS;105;Drawing I;MTh;09:50 am;12:20 pm;Jewett Art Center-200;Jewett Art Center;200;1;15;3;6;18;;ARS;Arts, Music, Theatre, Film and Video;None.;A foundational course in observational drawing with attention to the articulation of line, shape, form, gesture, perspective, and value. Studio work introduces a range of traditional drawing tools and observational methods while exploring a variety of approaches to image making and visual expression. In-class drawing exercises and weekly homework assignments address a range of subjects including the human figure. Recommended for all students and required for those majoring in studio art or architecture.;;;
10413;ARTS 105 02;;ARTS 105 Drawing I;ARTS;105;Drawing I;MTh;02:50 pm;05:20 pm;Jewett Art Center-200;Jewett Art Center;200;1;18;0;6;18;;ARS;Arts, Music, Theatre, Film and Video;None.;A foundational course in observational drawing with attention to the articulation of line, shape, form, gesture, perspective, and value. Studio work introduces a range of traditional drawing tools and observational methods while exploring a variety of approaches to image making and visual expression. In-class drawing exercises and weekly homework assignments address a range of subjects including the human figure. Recommended for all students and required for those majoring in studio art or architecture.;;;
10162;ARTS 108 01;;ARTS 108 Photo I: Introduction to Photography;ARTS;108;Photo I: Introduction to Photography;MTh;01:30 pm;04:00 pm;Jewett Art Center-247;Jewett Art Center;247;1;13;1;N/A;14;;ARS;Arts, Music, Theatre, Film and Video;None;Photo I is an introduction to the foundations of the medium. Digital color photography skills will be learned through camera work, lighting, retouching and printing. Conceptual, aesthetic, and critical skills essential to understanding photography's broader role in contemporary art and society will be learned through assignments, readings, discussions, lectures, gallery visits, and group critiques.|;;;
14074;ARTS 111 01;;ARTS 111 Color Theory;ARTS;111;Color Theory;TF;09:50 am;12:20 pm;Jewett Art Center-200;Jewett Art Center;200;1;10;6;6;16;;ARS;Arts, Music, Theatre, Film and Video;None;In this studio-based course students are introduced to color theory through observation, experimentation, lectures, readings, discussion, and of course studio projects. Color will be approached from a wide variety of fields covering sciences, philosophy, cultural and social studies, history and perception. The course will encourage students to consider the role of color in their personal work empowering them with its effective and expressive use. The goal of the course is to broaden the understanding of color for students via experience and its innumerable applications.;;;
11256;ARTS 113 01;;ARTS 113 Three-Dimensional Design;ARTS;113;Three-Dimensional Design;TF;09:50 am;12:20 pm;Beebe Hall-019;Beebe Hall;019;1;10;6;N/A;16;;ARS;Arts, Music, Theatre, Film and Video;None.;This introductory course explores the basic formal and spatial considerations when working with three-dimensional structure and form. Studio projects incorporate a range of materials and methods of visualization. Outside assignments and class discussions are aimed toward helping students enhance their creativity and spatial awareness while acquiring sensitivity for placement, process, and materials. Required for Architecture majors.;;;
10121;ARTS 165 01;;ARTS 165 Introduction to Video Production;ARTS;165;Introduction to Video Production;TF;09:50 am;12:20 pm;Jewett Art Center-464;Jewett Art Center;464;1;8;4;N/A;12;;ARS;Arts, Music, Theatre, Film and Video;None.;Introduction to the principles of video production with emphasis on developing basic skills of recording with a video camera, scripting, directing, and editing short videos.;;;
10617;ARTS 207 01;;ARTS 207 Sculpture I;ARTS;207;Sculpture I;TF;01:30 pm;04:00 pm;Beebe Hall-020;Beebe Hall;020;1;6;10;N/A;16;;ARS;Arts, Music, Theatre, Film and Video;ARTS 105 or ARTS 113 or permission of the instructor required.;An exploration of sculptural concepts through the completion of projects dealing with a variety of materials including clay, wood, and plaster. With an emphasis on working from direct observation of the model. Note that this class takes advantage of swing space facilities and addresses more site-based studio projects while the Pendleton sculpture studios are under renovation.;;;
13654;ARTS 208 01;;ARTS 208 Intermediate Photography: The digital/analog rift;ARTS;208;Intermediate Photography: The digital/analog rift;MTh;09:50 am;12:20 pm;Jewett Art Center-457;Jewett Art Center;457;1;10;2;N/A;12;;ARS;Arts, Music, Theatre, Film and Video;ARTS 108/CAMS 138 or permission of the instructor required.;Building on the foundation of ARTS 108/CAMS 138, Intermediate Photography will address contemporary art photography practices that engage both traditional darkroom and digital processes. Students will develop photo-based projects while learning experimental darkroom techniques, advanced studio and location skills, digital scanning and retouching, inkjet printing, and multimedia production. Emphasis is on experimentation, research, and hybrid practices.;;;
11430;ARTS 218 01;;ARTS 218 Introductory Painting;ARTS;218;Introductory Painting;TF;01:30 pm;04:00 pm;Jewett Art Center-244;Jewett Art Center;244;1;13;3;N/A;16;;ARS;Arts, Music, Theatre, Film and Video;ARTS 105 or ARTS 109 or permission of the instructor required.;An introduction to the fundamental issues of painting, emphasizing color, composition, and paint manipulation through direct observation. Outside assignments, slide presentations, and class discussions aimed toward helping students gain technical skills, visual sophistication, and critical awareness. Students paint from a variety of subjects, including the self-portrait and still life.;;;
14075;ARTS 223 01;;ARTS 223 Alternative Print Methods: The Graphic Impulse;ARTS;223;Alternative Print Methods: The Graphic Impulse;TTh;06:30 pm;09:00 pm;Clapp Library-458;Clapp Library;458;1;11;1;N/A;12;;;;At least one of the following: ARTS 105, WRIT 115/ARTS 115, ARTS 108/CAMS 138, or ARTS 109/CAMS 139;An exploration of hybrid forms of graphic production, integrating old and new technologies in experimental ways. Based in Clapp Library’s Book Arts Lab, students develop visual and creative flexibility through hands-on manipulation of image sequence, wordplay, color layering, photo-digital processing and alternative forms of distribution/display. This highly interactive studio group travels to NYC for the annual print fairs, interacts with visiting artists and hosts a large scale, outdoor printing event on the Davis Plaza to consider how the graphic impulse drives Art and visual culture. Recommended for students interested in media arts, design or book studies.;;;
13607;ARTS 255 01;;ARTS 255 Dynamic Interface Design;ARTS;255;Dynamic Interface Design;TF;09:50 am;12:20 pm;Jewett Art Center-247;Jewett Art Center;247;1;13;2;N/A;15;;ARS;Arts, Music, Theatre, Film and Video;ARTS 108 /CAMS 138, ARTS 109 and CS 110 or CS 111.;Critical examination of the expanding field of information and interface design for interactive media. Emphasis will be on effective visual communication, information design, and creative content within online media. Hands-on production will focus on design methods, multimedia Web, vector-based media, and dynamic audio. Screenings and discussions on contemporary practices, theoretical, artistic, and cultural issues.;;;
