regNum;classCode;professor;fullTitle;dept;dNum;titleString;day;time1;time2;location;building;room;credit;enrollment;available;fyReservedSeats;max;distributions;distCode;distDescription;prerequisites;description;waitlistType;firstComeFirstServe;waitlistNotes
13958;AFR 207 01;;AFR 207 Images of Africana People Through the Cinema;AFR;207;Images of Africana People Through the Cinema;T;07:00 pm;09:30 pm;Founders Hall-120;Founders Hall;120;1;22;3;N/A;25;;ARS;Arts, Music, Theatre, Film and Video;None;An investigation of the social, political, and cultural aspects of development of Africana people through the viewing and analysis of films from Africa, Afro-America, Brazil, and the Caribbean. The class covers pre-colonial, colonial, and postcolonial experiences and responses of Africana people. Films shown will include Sugar Cane Alley</em>, Zan</em> Boko</em>, and Sankofa</em>.;;;
13813;AFR 217 01;;AFR 217 The Black Family;AFR;217;The Black Family;TF;11:10 am;12:20 pm;Clapp Library-209;Clapp Library;209;1;7;23;N/A;30;;SBA;Social and Behavioral Analysis;None.;This course is an overview of the African American family in economic, sociological, psychological, economic, anthropological, and historical perspective. It is an examination of the complex interplay of self-definitions, societal, and community definitions among African American women, men, and children within the context of their families. The course is also an exploration of changing gender roles among African American women and men.;;;
13812;AFR 225 01;;AFR 225 Introduction to Black Psychology;AFR;225;Introduction to Black Psychology;W;07:00 pm;09:30 pm;Founders Hall-126;Founders Hall;126;1;24;6;N/A;30;;SBA;Social and Behavioral Analysis;None;Issues and perspectives in the study of the psychological development of Black people in America, past and present. Special consideration is given to such issues as the Afrocentric and Eurocentric ethos, the nature of Black personality as affected by slavery and racism, psychological assessment, treatment and counseling techniques, and the relationships between psychological research and social policy in American research.;;;
13960;AFR 234 01;;AFR 234 Introduction to West Indian Literature;AFR;234;Introduction to West Indian Literature;M;07:00 pm;09:30 pm;Founders Hall-305;Founders Hall;305;1;4;21;N/A;25;;LL;Language and Literature;None;A survey of contemporary prose and poetry from the English-speaking West Indies. Special attention is paid to the development of this literary tradition in a historical-cultural context and in light of recent literary theories. Authors to include V.S. Naipaul, Derek Walcott, Wilson Harris, Jean Rhys, and others.;;;
13961;AFR 255 01;;AFR 255 The Black Woman Cross-Culturally: Gender Dynamics in the Africana World;AFR;255;The Black Woman Cross-Culturally: Gender Dynamics in the Africana World;MTh;01:30 pm;02:40 pm;Founders Hall-319;Founders Hall;319;1;4;26;N/A;30;;SBA;Social and Behavioral Analysis;None;This course uses a multidisciplinary approach to examine theories and socio-cultural analyses of the lives, experiences, challenges and contributions of Black women from a cross-cultural perspective. Case studies will examine gender theories and gender dynamics in North and South America, the Caribbean, Europe, Asia and Africa. The course will interrogate women's evolving positions and gender relations and analyze the legacies of slavery, colonialism, nationalism and liberation struggles within a post-slavery, post-colonial and post-modern context.;;;
13592;AFR 297 01;;AFR 297 Medical Anthropology: A Comparative Study of Healing Systems;AFR;297;Medical Anthropology: A Comparative Study of Healing Systems;W;02:15 pm;04:45 pm;Founders Hall-307;Founders Hall;307;1;30;0;N/A;30;;SBA;Social and Behavioral Analysis;None;This course examines alternative healing systems that attempt to treat the whole person as a physical, social, and spiritual being and to promote community participation and healing. It offers new perspectives on the biomedical model as it examines the sociocultural context of the causes, diagnosis, prevention, and cure of disease. Examples of healing systems will be taken from Third World countries, particularly in Africa, the Caribbean, and Latin America, and from industrialized societies, particularly from African American and indigenous communities in the United States. Examination will be made of healing systems that include divination, herbal medicine, folk medicine, and faith healing.;;;
13962;AFR 311 01;;AFR 311 African Pentecostalism: Prophecy, Sorcery and Healing;AFR;311;African Pentecostalism: Prophecy, Sorcery and Healing;M;02:50 pm;05:20 pm;Founders Hall-227;Founders Hall;227;1;7;8;N/A;15;;REP;Religion, Ethics and Moral Philosophy;None;The seminar offers a critical examination of the history, theologies, leadership styles, and structure of neo-Pentecostal charismatic movements in both continental and diasporan Africa. It focuses on African Pentecostal communities that inhabit translocal spaces in the U.S., U.K., France, and the Netherlands. This course integrates theory and praxis to help students develop analytic skills to evaluate African notions of mystical power, framed within global Pentecostalism that deals with suffering, death, hope, and healing.;;;
10596;AMST 101 01;;AMST 101 Introduction to American Studies;AMST;101;Introduction to American Studies;TF;09:50 am;11:00 am;Founders Hall-207;Founders Hall;207;1;24;1;N/A;25;;HS;Historical Studies;This course is required of American Studies majors and should be completed before the end of the junior year.;An interdisciplinary examination of some of the varieties of American experience, aimed at developing a functional vocabulary for further work in American Studies or related fields. After a brief review of American history, the course will direct its focus toward important moments in that history, investigating each of them in relation to selected cultural, historical, artistic, and political events, figures, institutions, and texts. Course topics include ethnic and gender studies, consumption and popular culture, urban and suburban life, and contemporary American literature.;;;
14208;AMST 151 01;;AMST 151 The Asian American Experience;AMST;151;The Asian American Experience;TF;11:10 am;12:20 pm;Pendleton Hall East-339;Pendleton Hall East;339;1;44;6;N/A;50;;HS;REP;None;An interdisciplinary introduction to the study of Asian Americans, the fastest-growing ethnic group in North America. Critical examination of different stages of their experience from "coolie labor" and the "yellow peril" to the "model minority" and struggles for identity| roots of Asian stereotypes| myth and reality of Asian women| prejudice against, among, and by Asians| and Asian contributions to a more pluralistic, tolerant, and just American society. Readings, films, lectures, and discussions.;;;
14068;AMST 161 01;;AMST 161 Latinas/os in the U.S.;AMST;161;Latinas/os in the U.S.;MTh;11:10 am;12:20 pm;Pendleton Hall East-216;Pendleton Hall East;216;1;16;14;N/A;30;;SBA;Social and Behavioral Analysis;None;Latinas/os in the United States have diverse histories, cultures, and identities, yet many people in the U.S. assume a commonality among Latina/o groups. What links exist between various Latina/o groups? What are the main differences or conflicts between them? How do constructions of Latina/o identities contend with the diversity of experiences? In this course, we will examine a variety of topics and theories pertinent to the field of Latina/o Studies, including immigration, language, politics, pan-ethnicity, civil rights, racialization, border studies, media and cultural representation, gender and sexuality, and transnationalism, among other issues.;;;
13329;AMST 246 01;;AMST 246 Salsa and Ketchup: How Immigration is Changing the U.S.;AMST;246;Salsa and Ketchup: How Immigration is Changing the U.S.;MTh;11:10 am;12:20 pm;Founders Hall-128;Founders Hall;128;1;30;0;N/A;30;;SBA;Social and Behavioral Analysis;None;We live in a world on the move.  There are an estimated 214 million international migrants worldwide. One out of every 33 persons in the world today is a migrant. In the United States, immigrants and their children make up nearly 25 percent of the population. This course is about the changing face of the United States.  We use the Greater Boston Metropolitan area is a lab in which to explore race and ethnicity, immigration incorporation, and transnationalism. Fieldwork projects will examine how immigrants affect the economy, politics, and religion.  We will also track contemporary debates around immigration policy. |;;;
13814;AMST 249 01;;AMST 249 Celebrity, Fame, and Fortune;AMST;249;Celebrity, Fame, and Fortune;T;01:30 pm;04:00 pm;Pendleton Hall East-327;Pendleton Hall East;327;1;13;17;N/A;30;;SBA;Social and Behavioral Analysis;One 100-level unit or permission of the instructor.;A critical examination of the concept of status in sociological and social-scientific thinking. Focus on the historical rise of fame and its transformation into celebrity in the modern era. The relationship of status and violence. The meaning of sudden changes in good and bad fortune as attributes of status, including contemporary examples such as lottery winners, disgraced politicians, and media-driven attention to the powerful and pathetic. Fame and celebrity among women and minorities. The psychopathologies of leadership and conformity in political, religious, and educational institutions.;;;
13764;AMST 266 01;;AMST 266 American Literature from the Civil War to the 1930s;AMST;266;American Literature from the Civil War to the 1930s;TF;01:30 pm;02:40 pm;Founders Hall-120;Founders Hall;120;1;16;4;N/A;20;;;Language and Literature or Arts, Music, Theatre, Film and Video;None;<strong></strong>|<strong>Topic for 2016-17: From Page to Screen: American Novels and Films</strong>|This course will focus on important Americans novels from the late nineteenth century to the mid-twentieth century, and the attempts (sometimes successful, sometimes not, but always interesting) to turn them into movies, translating them from the page to the screen. Authors to be studied will include Henry James, Willa Cather, F. Scott Fitzgerald, Carson McCullers, and Edith Wharton. For comparison and contrast, we will move beyond the chronology of the course to consider books by two more recent authors, Malcolm X and Patricia Highsmith. Perhaps the main question we will ask is this: Is it possible to turn a great book, especially a great novel, into a great or even a good movie?|;;;
13963;AMST 281 01;;AMST 281 Rainbow Republic: American Queer Culture from Walt Whitman to Lady Gaga;AMST;281;Rainbow Republic: American Queer Culture from Walt Whitman to Lady Gaga;MTh;09:50 am;11:00 am;Jewett Art Center-450;Jewett Art Center;450;1;24;1;N/A;25;;HS;Historical Studies;None;Transgender rights, gay marriage, and Hollywood and sports figures’ media advocacy are only the latest manifestations of the rich queer history of the United States.  This course will explore American LGBTQ history and culture from the late nineteenth century to the present, with an emphasis on consequential developments in society, politics, and consciousness since Stonewall in 1969.  The course will introduce some elements of gender and queer theory| it will address historical and present-day constructions of sexuality through selected historical readings but primarily through the vibrant cultural forms produced by queer artists and communities.  The course will survey significant queer literature, art, film, and popular culture, with an emphasis on the inventive new forms of recent decades.  It will also emphasize the rich diversity of queer culture especially through the intersectionality of sexuality with race, ethnicity, class, and gender.;;;
13964;AMST 290 01;;AMST 290 Afro-Latinas/os in the U.S.;AMST;290;Afro-Latinas/os in the U.S.;MTh;02:50 pm;04:00 pm;Pendleton Hall East-216;Pendleton Hall East;216;1;12;9;N/A;20;;SBA;Social and Behavioral Analysis;None;This course examines the experiences and cultures of Afro-Latinas/os, people of both African and Latin American descent, in the United States. We will consider how blackness intersects with Latino identity, using social movements, politics, popular culture, and literature as the bases of our analysis. This course addresses these questions transnationally, taking into account not only racial dynamics within the United States, but also the influence of dominant Latin American understandings of race and national identity.  We will consider the social constructions of blackness and Latinidad| the intersections of race, class, gender, and sexuality in the Latino community| immigration and racial politics| representations of Afro-Latinas/os in film, music, and literature| and African American-Latino relations.;;;
14154;AMST 296 01;;AMST 296 Diaspora and Immigration in 21st-Century American Literature;AMST;296;Diaspora and Immigration in 21st-Century American Literature;TF;09:50 am;11:00 am;Founders Hall-227;Founders Hall;227;1;21;9;N/A;30;;LL;Language and Literature;None;This course explores the exciting new literature produced by writers transplanted to the United States or by children of recent immigrants.  We’ll consider how the perspectives of recent immigrants redefine what is American by sustaining linkages across national borders, and we’ll examine issues of hybrid identity and multiple allegiances, collective memory, traumatic history, nation, home and homeland, and globalization.  Our course materials include novels, essays, memoirs, and films.   We’ll be looking at writers in the United States with cultural connections to China, Egypt, Nigeria, Dominican Republic, India, Greece, Viet Nam, Bosnia, Ethiopia, and Japan. Some authors to be included: André Aciman, Chimamanda Adichie, Junot Díaz, Kiran Desai, Jeffrey Eugenides, Aleksandar Hemon, Lê Thi Diem Thúy,  Dinaw Mengestu, and Julie Otsuka.;;;
14173;AMST 299 01;;AMST 299 American Nightmares: The Horror Film in America;AMST;299;American Nightmares: The Horror Film in America;M;06:30 pm;09:30 pm;Founders Hall-120;Founders Hall;120;1;30;0;N/A;30;;ARS;Arts, Music, Theatre, Film and Video;None;An exploration of the horror film in America, from the early sound era to the present, with particular attention to the ways that imaginary monsters embody real terrors, and the impact of social and technological change on the stories through which we provoke and assuage our fears.  We&rsquo|ll study classics of the genre, such as Frankenstein, Cat People, Dawn of the Dead,</em> and</em> The Shinin</em>g, as well as a representative sampling of contemporary films, and read some of the most important work in the rich tradition of critical and theoretical writing on horror.;;;
13965;AMST 317 01;;AMST 317 Seminar: Advanced Topics in American Studies;AMST;317;Seminar: Advanced Topics in American Studies;W;02:15 pm;04:45 pm;Founders Hall-423;Founders Hall;423;1;14;1;N/A;15;;;Social and Behavioral Analysis or Historical Studies;Permission of Instructor: Required;<strong>Topic for 2016-17: The Real Barack Obama</strong><br />|This course examines Barack Obama, first, as a viable public intellectual who intervenes on discussions of race, religion, and other hot-button topics, and second, as a cultural phenomenon and symbol of significant social import. Students will critically engage Obama's writings and speaking, including his biography, sense of identity, and political philosophy. We will move to the events of his presidential campaign to understand his electoral victory, examining representations of Obama during and after the 2008 and 2012 elections. Instead of only situating President Obama in American history, or giving his supporters a platform to celebrate his ascendance, this seminar will ask students to unpack that ascendancy over the&nbsp|past eight years&nbsp|and to engage the broader discourses that make him a political and cultural lightning rod.[|];;;
14160;AMST 319 01;;AMST 319 Seminar: Religion, Law, and Politics in America;AMST;319;Seminar: Religion, Law, and Politics in America;W;09:50 am;12:20 pm;Pendleton Hall East-251;Pendleton Hall East;251;1;12;0;N/A;12;;HS;REP;REL 200, REL 217, REL 218, or at least one 200-level unit in American Studies or in American history, sociology, or politics| or permission of the instructor.;A study of the relationships among religion, fundamental law, and political culture in the American experience. Topics include established religion in the British colonies, religious ideologies in the American Revolution, religion and rebellion in the Civil War crisis, American civil religion, and the New Religious Right. Special attention to the separation of church and state, selected Supreme Court cases on the religion clauses of the First Amendment, and religious and moral issues in current American politics.;;;
10946;ANTH 104 01;;ANTH 104 Introduction to Cultural and Social Anthropology;ANTH;104;Introduction to Cultural and Social Anthropology;MTh;11:10 am;12:20 pm;Founders Hall-126;Founders Hall;126;1;30;0;N/A;30;;SBA;Social and Behavioral Analysis;None;A comparative approach to the concept of culture and an analysis of how culture structures the worlds we live in. The course examines human societies from their tribal beginnings to the postindustrial age. We will consider the development of various types of social organization and their significance based on family and kinship, economics, politics, and religion.;;;
13647;ANTH 206 01;;ANTH 206 Archaeology;ANTH;206;Archaeology;TF;11:10 am;12:20 pm;Pendleton Hall East-349;Pendleton Hall East;349;1;20;0;N/A;20;;SBA;Social and Behavioral Analysis;None;A survey of the development of archaeology. The methods and techniques of archaeology are presented through an analysis of excavations and prehistoric remains. Materials studied range from early hominid sites in Africa to the Bronze Age civilizations of the Old World and the Aztec and Inca empires of the New World. Students are introduced to techniques for reconstructing the past from material remains. The course includes a field trip to a neighboring archaeological site.;;;
13966;ANTH 219 01;;ANTH 219 Balkan Cinematic Representations;ANTH;219;Balkan Cinematic Representations;Th;06:00 pm;08:30 pm;Pendleton Hall East-239;Pendleton Hall East;239;1;6;14;N/A;20;;SBA;Social and Behavioral Analysis;None;In the course of Europe's road to modernity, the southeastern corner of the continent became known as the Balkans. The Western imagination rendered the peoples and the rich cultures of the area as backward, violent, and underdeveloped. This course examines the imagery of the area and its people through film. We will explore the use of history by filmmakers and the use of films in understanding a number of issues in the history of the Balkans. The course will trace the adoration of ancient Greek antiquity, the legacy of Byzantium and Orthodox Christianity as well as the Ottoman influence and the appearance of Islam. The historical past is (re)constructed and (re)presented in film, as are the national awakenings and liberation movements. The list of films we will watch and the anthropological and historical readings we will do aspire to cover various aspects of Balkan societies as revealed through visual and cinematic representations. Balkan film is politically, socially, and historically engaged, and we will use film narratives and stories to understand the area's diverse landscapes and cultures, religions and identities, love and hatred.;;;
14069;ANTH 239 01;;ANTH 239 Visual Culture of South Asia;ANTH;239;Visual Culture of South Asia;TF;09:50 am;11:00 am;Pendleton Hall East-130;Pendleton Hall East;130;1;12;8;N/A;20;;ARS;SBA;None;The Indian subcontinent is iconic for its rich and varied visual traditions&mdash|from Mughal miniatures to calendar art, monumental architecture to television soap operas. With the spread of "Bollywood" films beyond the subcontinent, and with American television now representing Indian culture during prime time, an anthropological perspective on South Asian visual culture is particularly timely. In this course, we will examine many of the diverse visual forms and practices of the region from an anthropological perspective&mdash|that is, focusing on the social practices and cultural formations that arise around and shape them. We will learn how anthropologists study South Asian visual practices, including photography, film, textiles, and comic books, and assess the implications of these practices for Western theories about visuality and modernity.;;;
14070;ANTH 243 01;;ANTH 243 The (In)Visible Native America: Past and Present;ANTH;243;The (In)Visible Native America: Past and Present;MTh;09:50 am;11:00 am;Pendleton Hall East-127;Pendleton Hall East;127;1;12;8;N/A;20;;SBA;Social and Behavioral Analysis;None;This course will examine the historical significance of Native Americans within anthropology as well as the contemporary challenge of defining Native American identity in a scientific context.&nbsp|The study of indigenous North American populations played a major role in the early formation of American anthropology as a discipline. The treatment of Native Americans as a subject for study has left a legacy across the social and natural sciences of thinking of Native peoples as research entities of the past, even as they remain communities of the present. Throughout anthropology&rsquo|s history, the discipline has played a paradoxical role in adding to our knowledge of North American prehistory and human biological variation, while contributing to the systematic erasure of the idea of contemporary Native peoples.&nbsp|;;;
13968;ANTH 245 01;;ANTH 245 Culture, Politics, and Power: Anthropological Perspectives on Latin America;ANTH;245;Culture, Politics, and Power: Anthropological Perspectives on Latin America;MTh;02:50 pm;04:00 pm;Pendleton Hall East-430;Pendleton Hall East;430;1;13;7;N/A;20;;SBA;Social and Behavioral Analysis;None;This course explores contemporary issues in Latin America from an anthropological perspective. We will discuss legacies of colonialism and Cold War power struggles, as well as the active role indigenous peoples and social movements are playing in crafting Latin American futures. We will trace the ways the region is enmeshed in transnational processes and migrations and analyze the intersection of culture, race, gender, and class in shaping urban centers, rural hinterlands, and livelihood strategies within them. In particular, we will discuss how ethnographic research – the long-term fieldwork conducted by anthropologists – can enrich our understanding of hotly debated issues such as statecraft, borders, and shifting meanings of citizenship| in/security, human rights, and democratization| and, illicit economies, extractive industries, and development.;;;
12255;ANTH 301 01;;ANTH 301 History and Theory in Anthropology;ANTH;301;History and Theory in Anthropology;M;06:00 pm;08:30 pm;Pendleton Hall East-251;Pendleton Hall East;251;1;11;4;N/A;15;;SBA;Social and Behavioral Analysis;Two 200-level units in anthropology, economics, history, political science, or sociology, or permission of the instructor.;This course introduces students to contemporary anthropology by tracing its historical development and its specific application in ethnographic writing. It examines the social context in which each selected model or "paradigm" took hold and the extent of cognitive sharing, by either intellectual borrowing or breakthrough. The development of contemporary theory will be examined both as internal to the discipline and as a response to changing intellectual climates and social milieu. The course will focus on each theory in action, as the theoretical principles and methods apply to ethnographic case studies.;;;
13969;ANTH 305 01;;ANTH 305 Ethnographic Film;ANTH;305;Ethnographic Film;T;01:30 pm;04:00 pm;Pendleton Hall East-216;Pendleton Hall East;216;1;13;2;N/A;15;;SBA;Social and Behavioral Analysis;ANTH 301 or two 200-level units in anthropology, cinema and media studies, economics, history, political science, or sociology or permission of the instructor.;This seminar explores ethnographic film as a genre for representing "reality," anthropological knowledge and cultural lives. We will examine how ethnographic film emerged in a particular intellectual and political economic context as well as how subsequent conceptual and formal innovations have shaped the genre. We will also consider social responses to ethnographic film in terms of the contexts for producing and circulating these works| the ethical and political concerns raised by cross-cultural representation| and the development of indigenous media and other practices in conversation with ethnographic film. Throughout the course, we will situate ethnographic film within the larger project for representing "culture," addressing the status of ethnographic film in relation to other documentary practices, including written ethnography, museum exhibitions, and documentary film.;;;
